,,R 417 | S 100,Mazeppa,F-Pn,Ms. 155,,Charles Malherbe Conservatoire Nal de Musique Paris,Partitur,,,,,Mazeppa | Partitur,,Mazeppa,Liszt (?) (Bleistift),"Orch (Picc, 2 Fl, 2 Ob, EHr, Klar in D, Klar in A, Bklar, 2 Fg, 4 Hr in F, 2 Trp in D, Trp in E, 2 Tpos, Bpos, Tb, Trg, Bck, grTr, Pk, Vl, Vla, Vlc, Kb)",,,,,,,,,,"[Joachim Raff 118597779] (schwarze Tinte), Liszt (schwarze, rote und grüne Tinte, Rötel, Bleistift)","21 Blatt zu 10 Bogen und 1 Einzelblatt (Einband, Vorsatz, Schmutztitel, 1 Titelseite, 42 Seiten Notentext, paginiert)
 ","Querformat, 272 x 347 mm, 18-23 Notenzeilen, handrastriert; Querformat, 268 x 340 mm, 16 Notenzeilen, handrastriert",,,,,,,,,,,,"letztes Einzelblatt mit dem Schluss ist oben links abgerissen (schräg, ca. 115 x 60 mm) und mit weißem Schöpfpaier restauriert
der anbängende Korrekturbogen aus weißerem Papier ist falsch herum eingebunden (Nr. 3-5, dann erst Nr. 1-2) 
Holzeinband (285 x 385 mm), rotbraun mit geschwungenen schwarze Linien durchzogen, 5 Blatt dickes Schutzpapier, 1 eingebundenes Titelseite 1 dünnes Schutzblatt)",korrigierte Abschrift einer früheren Variante,"Die Abschrift [Joachim Raffs 118597779] mit schwarzer Tinte beinhaltet zwar das komplette Stück, weist aber teilweise große Lücken in der Instrumentation auf. Die Abschrift ist von Liszt in mehreren Durchgängen sehr stark überarbeitet worden, was die Verwendung der unterschiedlichen Schreibmittel offenbart. Ergänzungen und Hinweise erfolgen vor allem mit Rötel und mit Bleistift, im Späteren Verlauf der Quelle auch mit schwarzer, roter und sogar dunkelgrüner Tinte. 
Gleich zu Beginn nimmt Liszt eine Taktergänzung vor, die er mit nur noch schwach lesbarem Rötel notiert: ""mit einen ganzen Takt Pause - im 2/3 Takt anfangen -"" Das Metrum trägt er entsprechend mit Rötel bei den Streichern nach. In der Abschrift folgen zahlreiche Ergänzungen, Streichungen und Korrekturen, zu Beginn überwiegend mit Bleistift und Rötel. Die notierte Musik weicht zum Teil erheblich von der späteren Druckfassung ab (s. bspw. S. 3 und 4, Zusätze der Bläser mit Bleistift; hier scheint Liszt ebenfalls unsicher gewesen zu sein, denn er setzt nachträglich vor der aufsteigenden Linie in Oboe und Fagott mit roter Tinte ein ""?""). S. 5 unten, harmonische Ergänzungen mit dunkelgrüner Tinte, aber mit schwarzer Tinte wieder gestrichen. S. 9 erste Korrekturen in den beiden vorletzten Takten (drittes System von oben) mit roter Tinte, ebenso S. 10, 2. System. In der weiteren Folge kommt die rote Tinte vermehrt zum Einsatz. Großflächige Streichungen mit Rötel auf S. 16 und 17, dazu der Hinweis, ""Vide Correctur N° 1"", diese findet sich am Ende des Manuskripts auf dem falsch eingebundenen Korrekturbogen (Bleistiftpaginierung 41). Diese ist mit Rötel überschrieben, ""Seite 17 Correctur N° 1"". Der Notentext ist zunächst mit schwarzer Tinte ausgeführt und dann offensichtlich mit roter Tinte nochmals überarbeitet worden, denn Liszt ergänzt nicht nur Keile, sondern streicht die letzten fünf Takte und ersetzt sie im darunter stehenden System mit einer v.a. rhythmisch modifizierten Version in roter Tinte. Am Abschluss folgt der Hinweis mit Rötel, ""Vide 3/4 | Seite 17"". S. 19 Strich des von Raff notierten Blechbläsersatzes mit dunkelgrüner Tinte sowie Korrektur mit jener, davor notiert Liszt die Instrumente mit Rötel, ""Tromba | tacet | Posaunen | xxx?"". S. 21 harmonische Ergänzungen mit grüner Tinte, wieder mit Rötel gestrichen und durch Variante in roter Tinte darunter ersetzt. S. 22/23, Präzisierung des ""Rithmo | dei Corni"" mit Rötel. S. 24 Ergänzung von Flöten und Oboen mit roter Tinte, darunter weitere Stimmen mit schwarze, jedoch mit einem grüßen ""?"" versehen. Im weiteren Verlauf Ergänzungen der Instrumentation mit roter Tinte und Streichung auf S. 29 mit Rötel. Darüber steht mit schwarzer Tinte ""sul d. (oder 2)"", einen Hinweis auf die Korrektur 2 gibt es hier nicht. Diese befindet sich auf dem letzten Blatt der Quelle (Bleistift-Pag 42) und beinhaltet den ""Marsch"", ist mit schwarzer Tinte ausgeführt und mit roter Ergänzt (Bass Posaune Solo). Gesamtstreichung der S. 33 mit Rötel. Kein Hinweis auf Korrektur Nr. 3, die sich auf der ersten Seite des Korrekturbogens mit schwarzer Tinte befindet (Bleistift-Pag 39), dort Hinweis am Ende ""Vide < Seite 34"". S. 35 Verweis mit Rötel ""Vide Correctur 4"". Diese befindet sich auf dem Korrekturbogen (Bleistift-Pag 40) und beinhaltet ""Flauti | etc | Tromba | Posaunen"", darüber blass mit Rötel der Hinweis auf die entsprechende Seite. Auf S. 36 Ergänzungen der Blechbläser mit Rötel, im Anschluss folgt die letzte Seite, blass mit Rötel mit ""Correctur 5"" überschrieben. Entsprechend sind große Teile der Seite gestrichen und werden durch die Korrektur mit schwarzer Tinte ersetzt (nur Blechbläsersatz). Diese (Bleistift-Pag 40) geht bis zum Ende der Komposition, das mit Doppelstrich und einem großen ""D"" markiert ist. Auf S. 38 findet sich das Ende der Partitur der frühen Fassung.
Die Paginierung stammt eigenhändig von Liszt mit Rötel und reicht bis S. 38; der Korrekturbogen ist von fremder Hand mit Bleistift paginiert (39-42).","Sämtliche Bögen und das Einzelblatt sind an einem ca. 3 cm breiten Papierstreifen einzeln angebunden, was das Blättern sehr einfach macht","Titelei: von fremder Hand mit schwarzer Tinte geschrieben, dazu die beiden Provenienzstempel in roter Farbe, Titelblatt ist eingebunden (271 x 211 mm) ",https://gallica.bnf.fr/ark:/12148/btv1b525094412,DTie,,,
