"Identifier | Nr.""",RISM ID no.,WVZ-Nr.,"Titel (normiert, nach MGG)",Bestandeshaltende Institution,"Signatur, neu","Signatur, vormalig",Besitzervermerk (intern),Ausgabeform (Typ),Funktion,Übergeordnete Quelle,Untergeordnete Quelle,RISM-Nr. der übergeordneten Quelle,Titelei Umschlag oder Titelblatt,Schreiber Titelei,Kopftitel,Schreiber Kopftitel,Besetzung (normiert),Tempoangabe (normiert),Metronomangabe,Sprachcode,Text-Incipit (diplomatisch),Widmung (diplomatisch),Datierung (diplomatisch),Datierung (maschinenlesbar),Ort (normiert),GND-Nr. Ort,Schrift (fremde Hand und Liszt),Umfang,Papiermaß,Wasserzeichen (intern),Verlag (normiert),Bezug zu Druck: Verlags-GND-Nr.,Bezug zu Druck: Plattennr.,Provenienz Station 1,Provenienz Station 2,Provenienz Station 3,Provenienz Station 4,Datierung ermittelt (maschinenlesbar),Ort ermittelt (normiert),Ort ermittelt GND-Nr.,Beschreibung physischer Merkmale / Zustand der Quelle (intern), Inhalt (interner Vermerk),"Notizen zur Quelle (vormals ""Beschreibung"", bleibt intern)",Kommentar zur Quelle (intern),Kommentar intern / Fragen (interne Kommunikation),Digitalisat,Bearbeiter,"Weiterführende Informationen (Ausgaben, Permalinks etc.) (intern)",Ausgabeform,Quellenautorität (für die Abbildung der Reiterstruktur in der Datenbank)
,1001260346,R 592b,Mignons Lied,D-WRgs ,GSA 60/D 7,,,Partitur,korrigierte Stichvorlage,,,,Mignon | (Für Alt Stimme),,Mignon,,"A, Kl","Sehr langsam, überspannt",,Deutsch,"Kennst du das Land, wo die Citronen blühn",,,,,,"[Joachim Raff 118597779] (schwarze Tinte), Liszt (Bleistift), Dr (Bleistift)","4 Blatt zu 2 Bogen (1 Titelseite, 6 Seiten Notentext, 1 Leerseite, paginiert)","Hochformat, 286 x 219 mm, 12 Notenzeilen, handrastriert",,,,,,,,,,,,,,"Saubere Abschrift von Raff, sporadische Annotationen zur Seiteneinrichtung vom Drucker mit Bleistift; Korrektur der Bassnote G (statt As) auf S. 8, T. 2, von Liszt selbst stammt wohl nur die Paginierung.",Fassung für Alt-Stimme,,https://ores.klassik-stiftung.de/ords/f?p=401:2:::::P2_ID:191282,URoe,,,
,1001260347,R 592a,Mignons Lied,D-WRgs,GSA 60/D 7c,,,Partitur,korrigierte Stichvorlage,,,,Mignon's Lied ,,Mignon,,"Singst, Kl","Langsam, überspannt",,Deutsch,"Kennst du das Land, wo die Citronen blühn",,,,,,"zS (schwarze und rote Tinte), Liszt (rote Tinte)","6 Blatt zu 3 Bogen (1 Titelseite, 7 Seiten Notentext, 2 Leerseiten, paginiert)","Querformat, 315 x 239 mm, 12 Notenzeilen, handrastriert",,,,,,,,,,,,,,"Eintragungen mit roter Tinte betreffen Tempi, Dynamik, Phrasierung, Pedalisierung und Korrekturen im einzelner Takte. Stammen teilweise von Liszt (zB. S. 2, Ende 3. System). Schlusstakt ist gestrichen und als 2 Takte neu komponiert (S. 7, Liszt).","Zuordnung Raabe-WV laut Findbuch, Fassungen vergleichen",Titelei: mit kalligraphischen Verzierungen,https://ores.klassik-stiftung.de/ords/f?p=401:2:::::P2_ID:191285,URoe,,,
,1001307107,R 592c,Mignons Lied,D-WRgs,GSA 60/D 8,,,Partitur,,,,,Mignon | (italien. Text) ,,Mignon,,"Singst, Kl",Lento assai,,Italienisch,"Sai tu la terra, ove l'arancio spiega",,,,,,"zS (schwarze Tinte), Liszt (schwarze Tinte)","8 Blatt zu 4 Bogen (1 Titelseite, 9 Seiten Notentext, 6 Leerseiten, teilpaginiert)","Hochformat, 355 x 270 mm, 14 Notenzeilen, handrastriert",DE CANSON FRÈRE VIDALON-LES-ANNONAY (rechter Rand),,,,,,,,,,,,,"Saubere Abschrift, Eintragungen von Liszt betreffen Dynamik (zB. S. 1, letzten 2 Takte), Pedalisierung (zB. S. 3), Tempoangabe (zB. S. 4, 2. System, letzter Takt).","andere Fassung: E-Dur, 6/4-Takt, italien. Text (""Sai tu la terra"")",Titelei: Archivar (Bleistift),https://ores.klassik-stiftung.de/ords/f?p=401:2:::::P2_ID:191287,URoe,,,
,1001307117,R 592,Mignons Lied,D-WRgs,"GSA 60/D 8,1",,,Stimme,,,,,,,Mignon,,Singst,,,Französisch,Le connais tu? Ce pays enchanté,Leo d' Ageni ,Leo d' Ageni | Weimar 23 Juni 1883,1883-06-23,Weimar,4065105-8,"zS (schwarze und rote Tinte), Liszt? (blauer Stift), zS (schwarze Tinte, Bleistift, gelber Stift)","5 Blatt zu 1 Bogen und 3 Einzelblatt (7 Seiten Notentext, 3 Leerseiten, paginiert)","Querformat, 178 x 268 mm, 8 Notenzeilen, gedruckt (B & H. Nr. 19 C.)",,,,,"1970-06-09, [Günther Kraft 134171632], GSA-Findbuch",,,,,,,,,"Saubere Abschrift der Singstimme in Es-Dur ohne Klavierbegleitung mit der Textübersetzung von Leo d'Ageni (Altsänger in Weimar). Der Notentext entspricht weitgehend der Fassung für Alt-Stimme. Der Titel und die signierte Datierung sind mit roter Tinte geschrieben und stammen eventl. wie die gesammte Abschrift von Leo d'Ageni. Dazu finden sich wenige Korrekturen im Notentext und dem Gesangstext vom Liszt? mit blauem Stift (S. 4, 6), die Markierungen mit Bleistift (S. 5, 7) und gelbem Stift (S. 1, 5) lassen sich nicht eindeutig zuordnen.","Signatur enthält französische Übersetzungen in der Handschrift des Notentextes zu Mignon von G. Lagye, A. Tardien, L. d'Ageni, dazu in einer weiteren Handschrift französische Übersetzung von G. Lagye zu Mignon mit einer Korrektur von Liszt, ""Wer nie sein Brot"" und ""Es war ein König in Thule"" (7 Blatt).; beiliegende Mappe NFG (GSA): Ankauf Prof. Günther Kraft, Weimar, 9.6.1970 (vgl. GSA-Findbuch)","Datierung: Leo d'Ageni, Name des Schreibers?! keine GND",https://ores.klassik-stiftung.de/ords/f?p=401:2:::::P2_ID:191288,URoe,,,
,,R 504,Domine salvum fac regem,D-WRgs,GSA 60/B 26b,,,Partitur,,,,,Domine salvum fac ,,Domine salvum fac regem,,"T, MCh (TB), Orch (2 Klar in A, 2 Ob, 2 Hr in C, 2 Hr in F, 2 Fg, 2 Trp in D, Apos, Tpos, Pk, Kb) ",,,,,,,,,,[Joachim Raff 118597779] (sepia und rote Tinte),"8 Blatt (1 Titelseite, 13 Seiten Notentext, 2 Leerseite, foliiert)","Hochformat, ??? x ??? mm, 13 Notenzeilen, handrastriert",,,,,,,,,,,,,,"Saubere Abschrift von Raff, kleine Korrekturen mit blauem Stift auf S. 6v und 7r.",Dazugehöriger? Stimmensatz befindet sich in D-WRha Mus.ms B 124 (RISM 250013836).,,https://ores.klassik-stiftung.de/ords/f?p=401:2:::::P2_ID:190899,BV,,,
,1001305871,R 610a,Über allen Gipfeln ist Ruh,D-WRgs,GSA 60/D 4,,,Partitur,,,,,,,,,"Singst, Kl",Langsam,,Deutsch,Ueber allen Gipfeln ist Ruh',,10 Dezember,xxxx-12-10,,,[Adolf Stahr 11875257X] (schwarze Tinte),"2 Blatt zu 1 Bogen (3 Seiten Notentext, 1 Leerseite)","Hochformat, 318-322 x 237 mm, 10 Notenzeilen, gedruckt (Cöln, bei Eck & Comp.)",,,,,,,,,,,,,,Enthält keine Korrekturen o.ä. von Liszt.,Schreiber laut GSA Datenbank,,https://ores.klassik-stiftung.de/ords/f?p=401:2:::::P2_ID:191278,URoe,,,
,1001305891,"R 582a,1; R 582a,2; R 582a,3; R 609a; R 610a; R 579a; R 579b",Schiller- und Goethelieder,D-WRgs,GSA 60/D 5,,,Partitur,korrigierte Stichvorlage,x,,,,,"Lieder aus Schiller's ""Tell"" | Schiller und Göthe | Lieder | von | Franz Liszt | Lieder aus Schiller's ""Tell",,"Singst, Kl",,,,,,,,,,"zS (schwarze Tinte), Liszt (schwarze Tinte, Rötel, Bleistift)","18 Blatt zu 8 Bogen und 2 Einzelblatt (Fadenheftung, 35 Seiten Notentext, 1 Leerseite, paginiert)","Hochformat, 320 x 235-238 mm, 12 Notenzeilen, handrastriert; Korrekturblatt S. 25, Hochformat, 326 x 255 mm, 20 Notenzeilen, handrastriert",,,,T. H. 10566,,,,,,,,Die Bogen sind teils aus der Fadenheftung gerissen.,,"Die mit Bleistift geschriebene Paginierung stammt von Liszt. Seine Hinzufügungen betreffen Titel- und Textkorrekturen, Stimmenangaben, Dynamik, Tempi, Phrasierungen, Noten- bzw. Taktstreichungen und -korrekturen, Fingersätze. Die Abschrift enthält weitere Eintragungen (Plattennummer, Seitenaufteilung) mit Bleistift.",,"Kopftitel: Lieder aus Schiller's ""Tell"" gestrichen (S. 1)",https://ores.klassik-stiftung.de/ords/f?p=401:2:::::P2_ID:191279,URoe,,,
,1001306070,"R 582a,1",Der Fischerknabe,D-WRgs,GSA 60/D 5,,,Partitur,korrigierte Stichvorlage,,,1001305891,,,1.,,"T, Kl","Allegretto, senza slentare",,Deutsch,Es lächelt der See,,,,,,,S. 1-8 (von 18 Blatt),,,,,,,,,,,,,,,"Liszt ergänzt mit schwarzer Tinte Stimmen- und Tempoangaben sowie einige Angaben zu Fingersätzen, Pedalisierung, Dynamik und Phrasierung. Auf S. 7 und S. 8 verwendet er zusätzlich Rötel, um Angaben zur Dynamik und Phrasierung einzutragen. ",,,https://ores.klassik-stiftung.de/ords/f?p=401:2:::::P2_ID:191279,URoe,,,
,1001306072,"R 582a,2",Der Hirt,D-WRgs,GSA 60/D 5,,,Partitur,korrigierte Stichvorlage,,,1001305891,,,2.,,"Singst, Kl",Andante pastorale,,Deutsch,"Ihr Matten, lebt wohl!",,,,,,,S. 9-14 (von 18 Blatt),,,,,,,,,,,,,,,"Liszt ergänzt mit schwarzer Tinte und Rötel einige Angaben zu Tempo, Fingersätzen, Pedalisierung, Dynamik und Phrasierung. ",,,https://ores.klassik-stiftung.de/ords/f?p=401:2:::::P2_ID:191279,URoe,,,
,1001306076,"R 582a,3",Der Alpenjäger,D-WRgs,GSA 60/D 5,,,Partitur,korrigierte Stichvorlage,,,1001305891,,,3.,,"Singst, Kl",Allegro agitato assai,,Deutsch,Es donnern die Höh'n,,,,,,,S. 15-20 (von 18 Blatt),,,,,,,,,,,,,,,"Liszt ergänzt mit schwarzer Tinte einige Angaben zu Tempo, Dynamik und Phrasierung. Auf S. 18 streicht er im 1. System mit Rötel 2 Takte des Klavierzwischenspiels. Auf S. 20 streicht er im 6. Takt des 2. Systems mit Rötel die Bassstimme der Klavierbegleitung und notiert diese am linken Rand mit schwarzer Tinte neu. Zudem korrigiert er an der Stelle mit Rötel die Textverteilung. ",,,https://ores.klassik-stiftung.de/ords/f?p=401:2:::::P2_ID:191279,URoe,,,
,1001303392,R 46,Csárdás macabre,D-WRgs,GSA 60/I 90,,,Partitur,,,,,Csárdás macabre | von | Franz Liszt $ Csárdás macabre | von | Franz Liszt,[August Göllerich 118695762] (schwarze Tinte) $ [August Göllerich 118695762] (schwarze Tinte),,,Kl,,,,,,"(Budapest, Februar 81)",1881-02-xx,Budapest,4008684-7,"[August Göllerich 118695762] (schwarze Tinte), zS (schwarze Tinte)","8 Blatt zu 3 Bogen und 2 Einzelblatt (2 Titelseiten, 9 Seite Notentext, 5 Leerseiten, paginiert)","Hochformat, 330 x 255 mm, 12 Notenzeilen, handrastriert, Blatt 1; Hochformat, 296 x 225 mm, 10 Notenzeilen, handrastriert, Blatt 2-8", (M | RIANO) ,,,,,,,,,,,,,"Es handelt sich um eine sehr saubere Abschrift mit nur sehr wenigen Korrekturen mit schwarzer Tinte (S. 1, unterstes System, vorletzter Takt ""gis""; S. 7, Korrektur 3. System, 3. Takt, linke Hand; S. 9, 4. System, Streichung einiger unterer Bassnoten sowie der ersten beiden Takte), diese Korrekturen stammen laut GSA wohl nicht von Liszts Hand. Der Abschrift fehlt die in GSA 60/I 89 aufbewahrte neue Einleitung von Liszt, Zeichen, dass diese wirklich erst kurz vor dem Stich hinzugekommen ist.",,,https://ores.klassik-stiftung.de/ords/f?p=401:2:::::P2_ID:192443,,,,
,,R 441/2 | S 359/2 | G21/2,Ungarische Rhapsodie Nr. 2,US-Wc,ML96 .L58 (Case),,,Partitur,,,x,,Franz Liszt / Rhapsodie Hongroise / No. 12 $ No. 2,Liszt (blauer Stift),,,"Orch (Picc, 2 Fl, Ob, 2 Klar in B, 2 Klar in A, 2 Fg, 2 Hr in D, 2 Hr in F, Trp in D, 2 Tpos, Bpos, Tb, Ophikleide, Hrf, Trg, Bck, klTr, grTr, Pk, Vl, Vla, Vlc, Kb)",Andante moderato,,,,,,,,,"[Franz Doppler 116180064] (schwarze Tinte), Liszt (sepia Tinte, blauer und roter Stift)","27 Blatt (Umschlag, 1 Titelseite, 53 Seiten Notentext)","Hochformat, 328 x 259 mm, 20 Notenzeilen, handrastriert",,,,,,,,,,,,,,"Neben kleineren Ergänzungen von Tempo, Dynamik, Artikulation und kleinen Korrekturen liegen die folgenden auffälligeren Änderungen und Korrekturen vor:
- S. 2: Die Instrumentenbezeichnung und den Notentext der Klarinetten in B hat Liszt gestrichen und in der leeren Notenzeile der Oboen als Klarinetten in A neu geschrieben. In Takt 1 und 2 sind die Hörner in D überklebt und neu geschrieben. In Takt 3 und 4 fügt Liszt der Abschrift außerdem Notentext für die Trompeten, Posaunen und Tuba hinzu (sepia Tinte).
- S. 3-5: Von Seite 3 bis Seite 5, Takt 1, sind die Klarinetten in B gestrichen sepia Tinte, blauer Stift), auf Seite 3 schreibt Liszt sie in der Notenzeile darüber neu (sepia Tinte). Auf Seite 4 und 5 streicht er sie ersatzlos. Von Seite 3, Takt 5, bis Seite 5, Takt 2, streicht Liszt das Fagott (blauer Stift). 
Auf Seite 3 sind in Takt 1 und 2 die Hörner in F und die Fagotte überklebt und durch neuen Notentext ersetzt. Zudem fügt Liszt in Takt 3 und 4 Notentext für die Trompete, Posaunen und Tuba ein.
Auf Seite 4 streicht Liszt die verbliebenen Holzbläser (blauer Stift). In den Ersten Violinen, den Violen und den Violoncelli nimmt er mittels Rasuren und Überschreibungen in Takt 4 deutliche Änderungen vor (sepia Tinte).
Auf Seite 5 sind in der Harfe Takt 2 bis 5 gestrichen (sepia Tinte, blauer Stift). Takt 3 ist vollständig gestrichen bzw. durch die Harfenkadenz ersetzt, die Liszt in die beiden für Triangel und Becken vorgesehenen Notenzeilen neu schreibt, nun allerdings mit der Vorgabe ""Nota bene die Harfen Cadenz ohne Taktstrich bis [Linie, die an Takt 2 anschließt und gegen Takt 4 abgrenzt]""
- S. 6: Die Seite ist abgesehen von Takt 1 überklebt. Die Überklebung umfasst 5 Takte, den rechten Rand der Seite überlappt sie und ist daher klappbar gehalten.
- S. 8: Auf Seite 8 bis einschließlich der ersten Takthälfte von Takt 1 auf Seite 9 sind die Holzbläser und die Hörner gestrichen (blauer Stift). In Takt 3 sind die Ersten Violinen gestrichen (blauer Stift) und in der Notenzeile darüber neu geschrieben (sepia Tinte). 
- S. 9: In Takt 2 bis 3 sind die Violoncelli gestrichen und auf dem unteren Seitenrand neu geschrieben (sepia Tinte).
- S. 10: Liszt streicht von Takt 2 bis 4 die Hörner in D (roter Stift) und ersetzt sie in der freien Notenzeile der Flöten neu (sepia Tinte). In Takt 2 bis 3 streicht Liszt das Fagott und notiert es in die leere Notenzeile der Pauken unmittelbar darunter neu (sepia Tinte). In Takt 2 sind die Violoncelli gestrichen und unten auf dem Seitenrand neu geschrieben (sepia Tinte). Am rechten Seitenrand schreibt Liszt einen weiteren Takt, der zur Abschrift hinzukommt.
- S. 11: Liszt streicht die B-Klarinetten und notiert in der freien Notenzeile der D-Hörner Notentext für A-Klarinetten, um die Streichung zu ersetzen. Die F-Hörner sind ersatzlos gestrichen (roter Stift). In den Fagotten streicht Liszt den zweiten Takt (roter Stift) und schreibt ihn darunter in die freie Notenzeile der Posaunen. Liszt fügt am rechten Seitenrand der Abschrift einen weiteren Takt hinzu (sepia Tinte).
- S. 12: Liszt fügt der Abschrift auf dem linken Seitenrand einen Takt hinzu (sepia Tinte).
- S. 16: An der ersten Notenzeile bringt Liszt unmittelbar vor dem Doppelstrich (Takt 4) eine Markierung an und notiert dazu die Anweisung ""6 Takte Pausen - nur 1te Violinen allein"" (blauer Stift). Die Anweisung wiederholt er etwa auf der Hälfte der Seitenhöhe noch einmal. Unten rechts über der leeren Notenzeile der Kontrabässe befindet sich eine schmale Einklebung, die die sechs von der 1ten Violine allein zu spielenden Takte enthält. Die Einklebung ist beim Doppelstrich mittels einer Linie mit der Notenzeile der 1ten Violine verbunden (blauer Stift). Von Takt 5 bis 7 ist die rechte Hand der Harfe gestrichen (roter Stift) und in der Notenzeile direkt darüber ersetzt (sepia Tinte).
- S- 17-18: Die rechte Hand der Harfe ist durchgängig gestrichen (roter und blauer Stift) und in der Notenzeile darüber durch neuen Notentext ersetzt (sepia Tinte).
- S. 20-21: Auf den Seiten 20 und 21 sind die Fagotte gestrichen und von Liszt in der Notenzeile darunter durch das Erste Fagott solo ersetzt (sepia Tinte). Auf Seite 21 ist außerdem die Harfe gestrichen, Liszt hat sie in den beiden Notenzeilen darüber ersetzt und auf dem rechten Seitenrand um einen zusätzlichen Takt ergänzt (sepia Tinte).
- S. 22: Die Seite ist gestrichen. Liszt weist an, ""Vide Änderung (22 und 23 Bis)"".
- S. 23: Seite 23 ist vollständig gestrichen (blauer Stift) und Liszt hat sie ganzseitig überklebt, allerdings ist die Überklebung gelöst worden. Die Überklebung enthält 9 Takte Notentext (sepia Tinte).
- S. 26: Im Fagott sind die Takte 1 und 2 gestrichen (blauer Stift), Liszt hat ersetzenden Notentext direkt darunter in der in diesen Takten freien Notenzeile der Trompete geschrieben (sepia Tinte).
- S. 30: In Takt 2 bis 3 streicht Liszt die F-Hörner ersatzlos und verändert die D-Hörner (sepia Tinte).
- S. 33: In Takt 3 bis 5 streicht Liszt die Oboen und schreibt sie darüber in der freien Notenzeile der Piccoloflöte neu (sepia Tinte).
- S. 35: In Takt 4 streicht Liszt Flöten, Piccoloflöten und Oboen ersatzlos. Zu den Oboen notier er allerdings: ""bleibt Gut"".
- S. 36: In Takt 3 bis 4 streicht Liszt die Oboen und notiert sie auf dem oberen Seitenrand neu (sepia Tinte). In Takt 4 bis 5 streicht er ersatzlos Trompete, Posaunen und Tuba (sepia Tinte). Den letzten Takt auf der Seite streicht er (blauer Stift) und ersetzt ihn durch zwei neue Takte; abgesehen von den Flöten, für die er entsprechend auf dem oberen Seitenrand zwei neue Takte schreibt (sepia Tinte), schweigen sämtliche Instrumente.
- S. 37: In Takt 4 streicht Liszt ersatzlos Trompete, Posaunen und Tuba (blauer Stift).
- S. 39: Liszt streicht Takt 4 und 5 die Harfe und schreibt sie in den freien Notenzeilen darüber neu (sepia Tinte).
- S. 40: In Takt 2 und 3 streicht Liszt ersatzlos das Fagott (blauer Stift).
- S. 47: In Takt 3 und 5 streicht Liszt ersatzlos das Fagott (sepia Tinte).
- S. 50: In Takt 1 streicht Liszt die Piccoloflöte (blauer Stift) und schreibt sie auf dem linken Seitenrand neu (sepia Tinte), insgesamt hat er diesen Takt starken Rasuren unterzogen. Takt 2 ist vollständig gestrichen und mit dem Hinweis versehen, ""Vide Correctur Blatt A - 2 Takte"" (blauer Stift). In Takt 3 bis 4 ist die Erste Violine gestrichen und in der freien Notenzeile direkt darüber neu geschrieben (sepia Tinte).
- S. 51-52: Von Seite 51, Takt 3 bis einschließlich Takt 1 auf Seite 52 ist der Notentext vollständig gestrichen. Oben auf Seite 51 notiert Liszt dazu, ""Vide Correctur Blatt B 5 Takte"" (blauer Stift). Auf Seite 52 streicht er die Takte 4 bis 5 in Bassposaune und Tuba, er schreibt sie in der rechten Hand der Harfe neu (sepia Tinte).
- S. 54: Takt 5 bis 7 sind vollständig gestrichen, Liszt notiert dazu den Hinweis ""Vide Correctur Blatt C"" (blauer Stift).",,"Titelei:  [Umschlag:] Der Umschlag ist nicht zeitgenössisch. Die Numerierung ist die der Klavierfassung; [Titelseite:] Den mit rotem Stift ausgestrichen Titel hat [Franz Doppler 116180064] mit schwarzer Tinte geschrieben, ebenso die mit blauem Stift ausgestrichene, als römische Ziffer geschriebene Nummer der Rhapsodie: Rhapsodie hongroise | par | Fr. Liszt | No. XII;  die arabische Bezifferung ist mit blauem Stift geschrieben und stammt von Liszts Hand. 

Besetzung: 2 Klar in B und Ophikleide gestrichen",https://hdl.loc.gov/loc.music/musliszt.100683,BV,,,
,,R 136 | S 470 | A16c,"Marche au supplice de la Symphonie fantastique [Hector Berlioz, op. 14]",US-Wc,ML96 .L58 (Case),,,,korrigierte Stichvorlage,,,,,,Introduction L'Idée fixe $ Marche au Supplice,zS (schwarze Tinte),,Andante sostenuto. Allegretto non troppo,,,,,,,,,"zS (schwarze Tinte), Dr (blauer Stift, Bleistift)","7 Blatt zu 1 Bogen und 5 Einzelblatt (13 Seiten Notentext, 1 Leerseite, paginiert)","Hochformat, 334 x 248 mm, 12 Notenzeilen, handrastriert",,,1073010120,466,,,,,,,,,,"Die Abschrift ist äußerst sauber ausgeführt. Korrekturen finden sich kaum, am auffälligsten sind die Hinweise an den Stecher und die Eintragungen des Dr für die Einrichtung von Systemumbrüchen und dergleichen. Lediglich auf Seite 13 ist in Anschluss an die dritte Akkolade eine Ergänzung von drei Takten vorgesehen, markiert durch den Buchstaben ""a"" und eine Einfügemarke für den Beginn der Einfügung. Vor der vierten Akkolade markiert der Buchstabe ""b"" und wiederum eine Marke die Fortsetzung nach der Einfügung (blauer Stift, Bleistift). Die einzufügenden Takte finden sich auf Seite 14 in der ersten Akkolade. Die darauf folgenden beiden letzten Akkoladen bilden den Schluss des Stückes und sind vom letzten Takt auf Seite 13 ausgehend fortzusetzen, markiert durch den Buchstaben ""c"" (blauer Stift).",,"Kopftitel: Der Titel ""Introduction L'Idée fixe"" befindet sich auf Seite 1, der Titel ""Marche au Supplice"" auf Seite 4.

Besetzung nachtragen",https://hdl.loc.gov/loc.music/musliszt.100664,BV,,,
,1001340019,R 433 | S 115 | G5,Festmarsch zu Goethe's Jubiläumsfeier,D-WRgs,GSA 60/A 18,Ms A 18,Liszt-Museum Weimar,Partitur,korrigierte Stichvorlage,,,,Fest-Marsch | zu Goethe's Jubiläum-Feier | componirt von | F. Liszt | Partitur $ Fest Marsch | (Zur Goethe Jubiläum Feier) | für | Grosses Orchester | componirt von | Franz Liszt | Partitur | Preis | Edition für Piano 2m. - Arrangement vom Componisten selbst - Edition a 4 mains | Pr. | Eigenthum der Verleger | J. Schuberth & Co. Hamburg | Leipzig & NYork | = mit americanischer formel =,Liszt (blauer und roter Stift) $ Dr (Bleistift),Marsch zu Goethe's Jubiläum Feier,"[Joachim Raff 118597779] (schwarze Tinte), Liszt (schwarze Tinte)","Orch (Picc, 2 Fl, 2 Ob, 2 Klar in B, 2 Fg, 4 Hr in Es, 2 Trp in Es, 2 Tpos, Bpos, Tb, grTr, Bck, Pk, Vl, Vla, Vlc, Kb)",Allegro mosso,,,,,,,,,"[Joachim Raff 118597779] (schwarze Tinte, roter Stift), Liszt (schwarze Tinte, blauer und roter Stift, Bleistift), Dr (Bleistift)","24 Blatt zu 11 Bogen und 2 Einzelblatt (2 Titelseiten, 46 Seiten Notentext, paginiert)","Hochformat, 340 x 268 mm, 15-17 Notenzeilen und 1 Notenlinie, handrastriert",,J. Schuberth & Co.,5330993-5,2416,,,,,,,,Längsfalz,,"Sehr saubere Abschrift von Raff, von Liszt durchgesehen und sporadisch mit blauem Stift sowie Bleistift ergänzt (Tempo, Dynamik, Artikulation, Buchstaben, A-U). Der Notentext wird von ihm kaum korrigiert [s. S. 24, mit schwarzer Tinte]. Raff (?) markiert den Wechsel der Hörner ""in C."" mit rotem Stift [S. 20]. [S. 21] Strich der letzten zwei Takte, da in Zeile verrutscht (Pauke, roter Stift). [S. 31] NB-Hinweis mit rotem Stift, allerdings fehlt der Hinweis. Liszt trägt zudem an manchen Stellen die Besetzungsliste mit schwarzer Tinte nach (so auf [S. 32] sowie ""Coda"" mit Tinte und blauem Stift auf [S. 42]. 
Vom Drucker stammen Bleistiftzahlen und Markierungen für die Einrichtung der Partitur. Das Titelblatt ist auf der Verso-Seite noch einmal sauber mit Bleistift nachgearbeitet.",,"Titelei: von Liszt mit blauem Stift geschrieben und mit rotem Stift korrigiert, dazu Anmerkungenquer zur Seite mit Bleistift, den Druck betreffend, ""In 8vo eng u klein | zu theilen, [??] so zu edieren wie | die Sinfonischen Dichtungen bei Hartels."" Links oben mit roter Tinte: ""Fol: 200.""",https://ores.klassik-stiftung.de/ords/f?p=401:2:::::P2_ID:190395,DTie,https://haab-digital.klassik-stiftung.de/viewer/image/1684410029/4/,,
,,R 545,Das deutsche Vaterland,D-WRgs,GSA 60/Q 8,,Liszt-Museum Weimar,Partitur,,,,,,,"Was ist das | Deutsche Vaterland? | componirt | von | Franz Liszt |
für Cavallerie-Musik instrumentirt | von | W. Wieprecht","gedruckt, Liszt (schwarze Tinte), Wilhelm Wieprecht (?) (schwarze Tinte)",,"Allegro moderato, deciso",,Deutsch,Was ist des Deutschen Vaterland?,,,,,,"zS (schwarze Tinte), Liszt (schwarze Tinte)","30 Blatt zu ?? Bogen (Einband, 1 Titelseite, 56 Seiten Notentext, 11 Leerseiten)","Hochformat, ??? x ??? mm, 13 Notenzeilen, handrastriert",,,,,,,,,,,,"[kartonierter Einband; Außenseite Lyra, Innenseite jeweils türkises Blatt]",,"Akkurat saubere Abschrift von zS, Strophe 1 und 2 werden mit unterschiedlichem Text wiederholt, die Strophen 3 [S. 24] und 4 [S. 21] sind in Quelle vertauscht. Bis zu 8 Strophen sind in der Abschrift hervorgehoben, die finale 9. Strophe wird nicht einzeln überschrieben, sondern beginnt auf [S. 52] mit dem Alla breve. Von Liszt ist mit Tinte auf der leeren [S. 8] geschrieben, ""27 Takte | Pausen (den Singstimmen) | für die Einleitung | des Orchesters."" Über den Beginn der Notation auf [S. 9] schreibt er zudem, ""(die Singstimmen in D transponiren)"" und ergänzt die Tempovorschrift Allegro moderato mit dem Zusatz ""deciso."". Sonst sind keinerlei Eintragungen oder Korrekturen von Liszt auszumachen.","Merkwürdig, mit Ausnahme der zwei relativ unbedeutenden Kommentare keine Hinweise, dass Liszt dieses Arrangement durchgesehen hätte.","Bitte Blatt und Bogen zählen sowie generell den Zusammenhang der Quelle inklusiv des gedruckten Titelblattes, und des kartonierten (?) Einbands mit heller Außenseite (goldener Rahmen, Lyra zu Anfang) und die türkisen Innenseiten mit der Abschrift.

Kopftitel: GND zu Wilhelm Wieprecht: 117366021
Position des gedruckten Titelblattes in Quelle/Digitalisat unklar
Instrumentation von wem? handschriftlicher Zusatz mit Tinte wohl nicht von Liszt

Besetzung: MCh (TTBB), Orch (Hr in B, Hr, Hr in Es, 2 TenorHr, Tenorbass, 4 Pos, 2 Tb, Pk)",https://ores.klassik-stiftung.de/ords/f?p=401:2:::::P2_ID:202719,DTie,,,
